{
  "format": "cs-map-maker",
  "version": 1,
  "name": "Two-site sample",
  "profile": "two-site-3v3",
  "width": 56,
  "height": 44,
  "rows": [
    "########################################################",
    "########################........########################",
    "##########...............CCCCCC................#########",
    "##########.....................................#########",
    "###..................................................###",
    "###..................................................###",
    "###...............################....#..............###",
    "###...AAAAAAAA....################....#...BBBBBBBB...###",
    "###...AAAAAAAA..X.################....#...BBBBBBBB...###",
    "###...AAXXAAAA....################....#...BBXBBBBB...###",
    "###...AAAAAAAA....################....#...BBBBBBBB...###",
    "###...AAAAAAXA....################....#...BBBXBXBB...###",
    "###...AAAAAAAA....################....#...BBBBBBBB...###",
    "###...............################....#.X............###",
    "###...............################....#..............###",
    "###...............################....#..............###",
    "###...............################....#..............###",
    "###....#####....##################....###....##....#####",
    "###....#####....#########.............###....##....#####",
    "###....#####....#########........X....###....##....#####",
    "###....#####....#########.............###....##....#####",
    "###....#####....#########......##########....##....#####",
    "###....#####...................##########....##....#####",
    "###....#####...................##########....##....#####",
    "###....#####.................................##....#####",
    "###....##################....................##....#####",
    "###....##################....................##....#####",
    "###....##################......################....#####",
    "#####..##################..X...################....#####",
    "###....##################......################....#####",
    "###....####################....################....#####",
    "###..X.##################......################....#####",
    "###....##################......################....#####",
    "###....##################......################....#####",
    "###....##################......####................#####",
    "###....##################......####.....X..........#####",
    "###....##################......####................#####",
    "###................................................#####",
    "###............X...................#####################",
    "###................................#####################",
    "###.....................TTTTTTTT...#####################",
    "#####################..............#####################",
    "#####################..............#####################",
    "########################################################"
  ]
}
