{
  "format": "cs-map-maker",
  "version": 1,
  "name": "Minimal two-site fixture",
  "profile": "two-site-3v3",
  "width": 17,
  "height": 11,
  "rows": [
    "#################",
    "#T.T.T....#....A#",
    "#.........#....A#",
    "####.######....A#",
    "#...............#",
    "#..XXXX#XXXX....#",
    "#...............#",
    "####.######....B#",
    "#C.C.C....#....B#",
    "#.........#....B#",
    "#################"
  ]
}
