{
  "format": "cs-map-maker",
  "version": 1,
  "name": "Steelworks | 3v3 Single Site (Graybox)",
  "notes": "56 x 70 at 64 Hammer units per cell. Outdoor steel yard left, indoor welding hall mid, shipping warehouse right, centered one-site fabrication bay. X = heavy material/machinery full cover; I = indoor; . = open-air paved yard. CT defenders have early positions in all three lanes.",
  "profile": "one-site-3v3",
  "width": 56,
  "height": 70,
  "rows": [
    "########################################################",
    "########################################################",
    "########################################################",
    "#######################IIIIIIIIIII######################",
    "#######################IIIIIIIIIII######################",
    "#######################IIICCCCCIII######################",
    "#######################IIICCCCCIII######################",
    "#######################IIIIIIIIIII######################",
    "#################IIIIIIIIIIIIIIIIIIIIII#################",
    "#################IIIIIIIIIIIIIIIIIIIIII#################",
    "###############IIIIIIIIIIIIIIIIIIIIIIIIIIII#############",
    "######..........II###IIIIIIIIIIIIII###IIIIIIII##########",
    "######..........II###IIIIIIIIIIIIIII##IIIIIIII##########",
    "######...........I###IIIIXXXIIIIIIIIIIIIIIIIII##########",
    "######............IIIIIIIXXXIIIIIIIIIIIIIIIIII##########",
    "######............IIIIIIIIIIIIIXXIIIIIIIIIIIIIIIIIIII###",
    "###....####.......III####IIIIIII####IIIIIIIIIIIIIIIII###",
    "###...............III####IIIIIII####IIIIIIIII##IIIIII###",
    "###.##.........XX.#######IIIIIII#######IXIIII##IXXXXI###",
    "###.........XXXXX.#######IIIIIIIIIII###IXIIII##IXXXXI###",
    "###.........XXX...########IIIII########IIIIII##IXXXXI###",
    "###...XXXX........##IIIIIIIIIIIIIIIII##IIXXXI##IIIIII###",
    "###...............##IIXXXIIIIIIIIIIII##IIXXXI##IIIIII###",
    "###.............####IIXXXIIIIIIIIXXII##IIXXXI##IIIIII###",
    "###.............####IIXXXIIIIIIIIXXII##IIXXXI##IIIIII###",
    "###......XXXX.....##IIIIIAAAAAAAIXXII##IIIIIIIIIIIIII###",
    "###.XX...XXXX.......IIIIIAAAAAAAIIIIIIIIIIIIIIIIIIIII###",
    "###.XX..............IIIIIAAAAAAAIIIIIIIIIIIIIIIIIXXXI###",
    "###.XX..............IIIIIAAAAAAAIIIIIIIIIIIII##IIXXXI###",
    "###.XX..............IIIIIAAAAAAAIIIIIIIIIIIII##IIXXXI###",
    "###.XX..............IIIIIIIIIIIIIIIIIIIIIIIII##IIXXXI###",
    "###.XX........XXX.##IIIIIIIXXXIIIIIII##IIIIII##IIIIII###",
    "###...........XXX.##IXXXIIIIIIIIXXXII##IXXXII##IIIIII###",
    "###...........XXX.##IXXXIIIIIIIIXXXII##IXXXII##IIIIII###",
    "###....XXXXX..XXX.##IIIIIIIIIIIIIIIII##IXXXII##IIIIII###",
    "###....XXXXX......##IIIIIIIIIIIIIIIII##IIIIIIIIIIIIII###",
    "###...............########IIIII########IIIIIIIXXXIIII###",
    "###...............###IIIIIIIIIIIIIII###IIIIIIIXXXIIII###",
    "###...............###IIIXXIIIIIIIIII###IIIIIIIXXXIIII###",
    "###...............###IIIXXIIIIIIIIII###IIIIII##XXIIII###",
    "###.XXX....XXXXX..###IIIXXXXXIIIIIII###IIIIII##XXIIII###",
    "###.XXX...........###II#XXXIIIIIIIII###IIIIII##IIIIII###",
    "###.XXX...........###II#IIIIIIIXXXII###IIIIII##IIIIII###",
    "###.XXX..............IIIIIIIIIIXXXII###IXXXXI##IIIIII###",
    "###..................IIIIIIIIIIXXIIIIIIIIIIII##IIIIII###",
    "###.....XXX..........IIIIII###IXXIIIIIIIIIIIIIIIIIXXX###",
    "###.....XXX..........IIIIIIIIIIIIIIIIIIIIIIIIIIIIIXXX###",
    "###.....XXX.......###IXXXIIIIIIIIIIIIIIIIIIIIIIIIIIII###",
    "###...............###IXXXIIIIIIIIIII###IIIIIIIIIIIIII###",
    "###...............###IXXXIIIIXXIIIII###IIIIIIIIIIIIII###",
    "###########.......###IIIIIIIIXXIIIII####IIII############",
    "###########.......###IIIIIIIIXXIIIII####IIII############",
    "###########.......###IIIIIIIIIIIIIII####IIII############",
    "###########...........IIIIIIIIIIIIIIIIIIIIII############",
    "###########...........IIIXXXXXXXIIIIIIIIIIII############",
    "###########...........IIIXXXXXXXIIIIIIIIIIII############",
    "##############........IIIIIIIIIIIIIIIIIIIIII############",
    "#######################IIIIIIIIIII######################",
    "#######################IIIIIIIIIII######################",
    "#######################IIIIIIIIIII######################",
    "#######################IIIIIIIIIII######################",
    "#######################IIIIIIIIIII######################",
    "#######################IIIIIIIIIII######################",
    "#######################IIIIIIIIIII######################",
    "#######################IIITTTTTIII######################",
    "#######################IIITTTTTIII######################",
    "#######################IIIIIIIIIII######################",
    "#######################IIIIIIIIIII######################",
    "########################################################",
    "########################################################"
  ]
}
