{
  "format": "cs-map-maker",
  "version": 1,
  "name": "One-site sample",
  "profile": "one-site-3v3",
  "width": 56,
  "height": 44,
  "rows": [
    "########################################################",
    "########################........########################",
    "##########...............CCCCCC................#########",
    "##########.....................................#########",
    "###..................................................###",
    "###..................................................###",
    "###...............################....#..............###",
    "###...AAAAAAAA....################....#..............###",
    "###...AAAAAAAA..X.################....#..............###",
    "###...AAXXAAAA....################....#.....X........###",
    "###...AAAAAAAA....################....#..............###",
    "###...AAAAAAXA....################....#......X.X.....###",
    "###...AAAAAAAA....################....#..............###",
    "###...............################....#.X............###",
    "###...............################....#..............###",
    "###...............################....#..............###",
    "###...............################....#..............###",
    "###....#####....##################....###....##....#####",
    "###....#####....#########.............###....##....#####",
    "###....#####....#########........X....###....##....#####",
    "###....#####....#########.............###....##....#####",
    "###....#####....#########......##########....##....#####",
    "###....#####...................##########....##....#####",
    "###....#####...................##########....##....#####",
    "###....#####.................................##....#####",
    "###....##################....................##....#####",
    "###....##################....................##....#####",
    "###....##################......################....#####",
    "#####..##################..X...################....#####",
    "###....##################......################....#####",
    "###....####################....################....#####",
    "###..X.##################......################....#####",
    "###....##################......################....#####",
    "###....##################......################....#####",
    "###....##################......####................#####",
    "###....##################......####.....X..........#####",
    "###....##################......####................#####",
    "###................................................#####",
    "###............X...................#####################",
    "###................................#####################",
    "###.....................TTTTTTTT...#####################",
    "#####################..............#####################",
    "#####################..............#####################",
    "########################################################"
  ]
}
